114,20,DevOps,"100<#<1,000",Yes,".properties file;.xml file;.json file;.ini files;In a table within the database used for the application;In a table within a database dedicated to configuration;Environment variables (e.g., Bash);Application main arguments",Via an IO library to read the configuration storage.;Via dedicated classes/functions that we developed for configuration access,As attributes/variables with the same name of its associated configuration option;From tables and/or maps containing configuration options and values;Via method/function accessors (for example getMyOption),We read configuration options from a specific class/module,Any developer,Why not?,"Yes, they are defined in the architecture specifications;No, they are juste extracted from hardcoded constants;No planning, options are added ad hoc",Discussion between developers and architects.;Making tests until finding the optimal value for a parameter.;Ad hoc choices. It is up to the developer to decide.,Via Wiki or a web platform,"Yes. We do have a naming convention, but not all the developers respect it.",Never,3,Log file;Error message;Documentation;Debug the code;Google the error;Stack Trace,In a Wiki;In a Bug report (like Bugzilla),"Yes, I know the impact of the majority of configuration options.",Documentation.;Ask a colleague;Configuration option comments.;Configuration name is clear enough to be understood.;I understand configuration options from the source code,"No, they are almost stable","Remove them from the configuration files, and do not store them anywhere.",4,3,"framework, conventions and rules","Yes, we review both functional and technical configuration options.",Security implications of configuration options are tested;Test different configuration values;Using containers (like Docker) to limit the impact of configuration options.,Comment and document configuration options.,initialization,"no hardcode, document"115,7,Developer,10<#<100,Yes,".properties file;.json file;In a table within the database used for the application;Environment variables (e.g., Bash);Application main arguments",Via an IO library to read the configuration storage.;Via dedicated classes/functions that we developed for configuration access,As attributes/variables with the same name of its associated configuration option;From tables and/or maps containing configuration options and values;Via method/function accessors (for example getMyOption),We read configuration options from a specific class/module,Any developer,Usually developers need some specific option for their application,"Yes, they are defined in the client specifications;Yes, they are defined in the architecture specifications",Client requirements.;Discussion between developers and architects.;Making tests until finding the optimal value for a parameter.,By mail;Via Wiki or a web platform;Pull Request,"Yes. We do have a naming convention, and all the developers respect it.",Sometimes,2,Log file;Error message;Documentation;Stack Trace,In the commit message;In a Wiki;In a Bug report (like Bugzilla);In the configuration file,"Yes, I know the impact of all the configuration options.",Documentation.;Configuration option comments.;Configuration name is clear enough to be understood.,"No, they are almost stable","We do not remove them, we keep them in the configuration files.",4,3,Details of each possible values and some examples/usecases,"Yes, we review both functional and technical configuration options.",Default values are backed-up in a database to easily roll back.;Test different configuration values;Using containers (like Docker) to limit the impact of configuration options.,Reduce the number of configuration files.;Comment and document configuration options.;Splitting options into different categories,"Choosing between values for default value, as it should satisfy the most of developers","Good:1. Think carefully about need of new option2. Make sure default value isn't some very-very-very rare case3. Keep the orderBad:1. Don't dump all options into one bunch2. Don't avoid adding of new option as it may only need for few persons3. Don't be a jerk. If someone request new option - add it, or suggest some workaround atleast."116,17,Architect,"100<#<1,000",Yes,.properties file;.xml file;Application main arguments,Via an IO library to read the configuration storage.;Via a 3rd party framework dedicated to configuration;Via dedicated classes/functions that we developed for configuration access,Via method/function accessors (for example getMyOption),We read configuration options from a specific class/module,Architects and developers,"The presence of options is often dictated by the integration of other components in application, one element which only developers/architects of that part of application are aware of","No planning, options are added ad hoc",Ad hoc choices. It is up to the developer to decide.,Textual documentation;Pull Request,No. We do not have any configuration options naming convention.,Sometimes,4,Log file;Documentation;Debug the code,In a Bug report (like Bugzilla),"Yes, I know the impact of few configuration options.",Documentation.;Ask a colleague;I understand configuration options from the source code,"No, they never change. Once, they are created, they do not change anymore.","Remove them from the configuration files, and do not store them anywhere.",3,2,more 15 year,We do not review configuration options at all. We only review code.,Test different configuration values,Reduce the number of configuration files.;Reduce the configuration option dependencies;Comment and document configuration options.;Reduce the number of configuration options.,"Often, options types are not correct : we use a string or a number, where it is in fact an enum value, or some kind of deduced value.","Map configuration options to a class where options are type-safeDo not use multiple configuration sourceDo not override configuration options from multiple sources"117,14,Architect,<10,Yes,.properties file;In a table within a database dedicated to configuration;Application main arguments;Dynamically built based on the environment through dedicated scripts,Via a 3rd party framework dedicated to configuration;Via dedicated classes/functions that we developed for configuration access;Via call to a dedicated http API,From tables and/or maps containing configuration options and values;Via method/function accessors (for example getMyOption),We read configuration options from a specific class/module,Certain expert developers,They need to have a deep knowledge of the architecture,"Yes, they are defined in the client specifications;Yes, they are defined in the architecture specifications",Client requirements.;Architectural specifications.,Chat support (like Slack or Hangout);Via Wiki or a web platform;Textual documentation;Pull Request,"Yes. We do have a naming convention, and all the developers respect it.",Sometimes,4,Error message;Documentation;Debug the code,In the commit message;In a Bug report (like Bugzilla);In the configuration file,"Yes, I know the impact of all the configuration options.",Documentation.;Configuration option comments.;I understand configuration options from the source code,"Yes, they change but not frequently","We do not remove them, we keep them in the configuration files.",4,3,"Documentation explains possible values and related impact on the application in a user-friendly form, while, usually, comments are written in a more technical and more obscure language","Yes, we review both functional and technical configuration options.",Test different configuration values,Reduce the number of configuration files.;Allow only experienced people to modify configuration files.;Reduce the configuration option dependencies;Comment and document configuration options.;Reduce the number of configuration options.,See below,"default values should fit for most people, if there is an options to specific the background, make it default to white is better than green, because most people think that is more normal"118,16,Developer,<10,No,.xml file;In a table within the database used for the application;Application main arguments,Via an IO library to read the configuration storage.;Via dedicated classes/functions that we developed for configuration access,There is no clear mapping between options and code,We read configuration options in different places in the code,Any developer,"If the task assigned to a developer requires more options, then the developer is authorized to make the change. If necessary, then with collaboration with other team members or whomever might help resolve which options are needed.","No planning, options are added ad hoc",Discussion between developers and architects.,Orally,No. We do not have any configuration options naming convention.,Sometimes,3,Log file,In the configuration file,"Yes, I know the impact of the majority of configuration options.",Ask a colleague;Configuration name is clear enough to be understood.;I understand configuration options from the source code,"No, they are almost stable","Remove them from the configuration files, and do not store them anywhere.",2,2,Documentation is currently of low priority.,"Yes, but we review only technical configuration options.",Test different configuration values,Reduce the number of configuration files.;Allow only few people to modify configuration files.;Reduce the configuration option dependencies;Reduce the number of configuration options.,Discussing naming conventions. No settlement yet.,"Limit the number of them, give them meaningful names, and test them much and often."119,21,Developer,"100<#<1,000",Yes,".xml file;Environment variables (e.g., Bash);Application main arguments",Via dedicated classes/functions that we developed for configuration access,There is no clear mapping between options and code,We read configuration options in different places in the code,Any developer,There is no particular limitation on creation of new options.,"No planning, options are added ad hoc",Discussion between developers and architects.;Ad hoc choices. It is up to the developer to decide.,Via Wiki or a web platform,No. We do not have any configuration options naming convention.,Sometimes,4,Log file;Error message;Documentation;Debug the code;Stack Trace,In the commit message;In a Wiki;In a Bug report (like Bugzilla),"Yes, I know the impact of only configuration used in the code I worked on.",Documentation.;Ask a colleague;Configuration option comments.;I understand configuration options from the source code,"Yes, they change but not frequently","Remove them from the configuration files, and do not store them anywhere.",2,3,"Some documentation exists online, but it is not well maintained. There are no comments inside confguration files as such, these are machine-written; source code sometimes has comments.","Yes, we review both functional and technical configuration options.",Security implications of configuration options are tested;Test different configuration values,Allow only experienced people to modify configuration files.;Comment and document configuration options.;Reduce the number of configuration options.,"The existence of options implies an additional testing burden, and even when it is possible in principle to test a given option (it does not require any special operating system, for example), often it is not tested, or not all combinations of interacting options are tested.","Just keep the number of options to an absolute minimum, and document and test those you have."120,10,Architect,10<#<100,Yes,.properties file,Via an IO library to read the configuration storage.,As attributes/variables with the same name of its associated configuration option,We read configuration options from a specific class/module,ops guys,because ops guys are responsible for deployments,"Yes, they are defined in the client specifications;Yes, they are defined in the architecture specifications",Architectural specifications.;Discussion between developers and architects.,By mail,"Yes. We do have a naming convention, and all the developers respect it.",Sometimes,3,Log file,In the commit message;In a Wiki,"Yes, I know the impact of all the configuration options.",Documentation.;I understand configuration options from the source code,"No, they are almost stable","Remove them from the configuration files, and do not store them anywhere.",3,5,this is essential to the person who will set the value,"Yes, we review both functional and technical configuration options.",Test different configuration values,Comment and document configuration options.,configuration of several environments,follow 12 factor apps121,1,Developer,<10,Yes,.properties file;.xml file;.json file,Via a 3rd party framework dedicated to configuration,Via method/function accessors (for example getMyOption),We read configuration options from a specific class/module,Certain expert developers,for security purposes,"Yes, they are defined in the architecture specifications",Architectural specifications.;Discussion between developers and architects.,Via Wiki or a web platform,"Yes. We do have a naming convention, and all the developers respect it.",Sometimes,3,Log file;Error message;Documentation;Stack Trace,In the commit message;In a Bug report (like Bugzilla),"Yes, I know the impact of all the configuration options.",Documentation.,"No, they are almost stable",Remove them and comment in the commit message,4,3,Within the configuration it depends on the level of experience of the developer. We have processes in place to document configuration options within the application. ,We do not review configuration options at all. We only review code.,We have a static analysis tool inspired by checkstyle to enforce configuration conventions.;Security implications of configuration options are tested,Reduce the number of configuration files.;Allow only experienced people to modify configuration files.;Reduce the configuration option dependencies,Generally I find developers dislike using configuration files and prefer using annotations when it makes sense.  Too many configuration files or too many attributes declared in a configuration file can make an application hard to debug or maintain.  The learning curve is longer for the less experienced developer. Moving from configuration files to annotations has helped us to alleviate these problem.,Good. 1. Move to annotations 2. Agree on what configurations you will need in the architectural/design phase. 3. Document configurations thoroughly. Bad. 1. Too many config files. 2. Too many settings with a config file. 3. Use configuration based design only when necessary.122,6,Developer,<10,Yes,Application main arguments;.Yamel,Via an IO library to read the configuration storage.;Via dedicated classes/functions that we developed for configuration access;via our own command line arg parser,As attributes/variables with the same name of its associated configuration option,We read configuration options from a specific class/module,Any developer,"If any developer needs to add an option, they can do it","No planning, options are added ad hoc",Ad hoc choices. It is up to the developer to decide.,Chat support (like Slack or Hangout);Via Wiki or a web platform;Pull Request,No. We do not have any configuration options naming convention.,Never,4,Log file;Error message;Debug the code;Stack Trace,Nowhere,"Yes, I know the impact of all the configuration options.",Configuration name is clear enough to be understood.;I understand configuration options from the source code,"No, they are almost stable","Remove them from the configuration files, and do not store them anywhere.",4,2,"Options themselves are not commented, only the getters and setters for a certain option type (like bool, int). However, options are explained in the wiki.","Yes, we review both functional and technical configuration options.",Test different configuration values,Comment and document configuration options.;Planning ahead the creation of options.,The most important problem is knowing what options our users want and how to tailor those options to that audience. Often times we can't communicate with all of our users and that creates a very big gap of understanding between developers and our userbase.  We have to guess what our users want and the issue with that is that we have an audience that is comprised of very different people who have different needs and who have very different goals. We have to account for users of our software as well as developers that build addons to it. This is even more complicated in the case of our project because we have to even consider people who aren't directly using or developing for our platform because Glowkit is a fork of an actively used project. We can't really solve this issue but we can lessen its effects by determining use cases and finding configuration options that could be created to help that use case.,"I think that every configuration option you have should be supported by a use case. Even if you don't have planning, if you can't think of a valid use case that the configuration option will help that can't be helped more by another solution, don't add it. Next, have good defaults. Know that a lot of your users will not change options and all of them will expect your software to work well with the defaults. Finally, make sure you document your options. This is extremely important. You are making these options for your users and your users are not going out of their way to find out what an option does.As for bad practices, don't make a config option for everything. You may be tempted to solve every user issue with another option, but sometimes you have to decide on some major part of your code that you will have to have a concrete flow or design for. Second, do not change configuration options too much. If your config options change rapidly, you are just making it harder for the users of your config. Third, don't have confusing names internally or user-facing. This just confuses everyone involved."123,15,Architect,10<#<100,Yes,.json file;.ini files;In a table within the database used for the application,Via an IO library to read the configuration storage.;Via dedicated classes/functions that we developed for configuration access,As attributes/variables with the same name of its associated configuration option;Via method/function accessors (for example getMyOption),We read configuration options from a specific class/module,Any developer,"As the team grew, many developers needed to have access to the options. Therefore, instead of centering all that work in one person, we decided to let everyone add new options/features, provided the lead architect reviewed the code when it was committed to our git","No, they are juste extracted from hardcoded constants",Client requirements.;Architectural specifications.;Discussion between developers and architects.,Orally;Textual documentation,"Yes. We do have a naming convention, but not all the developers respect it.",Sometimes,4,Log file;Error message;Debug the code;Stack Trace,In the commit message;In text document,"Yes, I know the impact of all the configuration options.",Ask a colleague;Configuration option comments.;I understand configuration options from the source code,"No, they are almost stable","We do not remove them, we keep them in the configuration files.",2,2,"Probably because everyone is always in a rush, having to fulfill tough deadlines.","Yes, but we review only technical configuration options.",Default values are backed-up in a database to easily roll back.;Test different configuration values,Reduce the number of configuration files.;Allow only few people to modify configuration files.;Allow only experienced people to modify configuration files.;Reduce the number of configuration options.,"Lack of documentation would be the most important problem I have ever faced, and I usually face.",rdomander@rvc.ac.uk124,12,Academic,<10,No,.properties file;.xml file,Via an IO library to read the configuration storage.,From tables and/or maps containing configuration options and values,We read configuration options from a specific class/module,Certain expert developers,"They encounter the new needs first, so they make the configurations.","No, they are juste extracted from hardcoded constants",Ad hoc choices. It is up to the developer to decide.,Pull Request,No. We do not have any configuration options naming convention.,Often,3,Log file;Error message;Documentation,Nowhere,"Yes, I know the impact of the majority of configuration options.",Documentation.,"Yes, they change but not frequently","Remove them from the configuration files, and do not store them anywhere.",2,2,"The configuration system is relatively new, so documentation work has not been a high priority.","Yes, but we review only functional configuration options",Test different configuration values,Reduce the number of configuration files.;Reduce the number of configuration options.,"Nesting options was not originally planned for, but was quickly encountered.  This led to a few additional iterations that could have been avoided.  Using standard format (JSON, YAML, S-Expressions) would have saved some up-front costs but the original system sort of grew organically.",2017/04/10 9:35:16 PM UTC+1125,4,Manager,10<#<100,Yes,.properties file;.xml file,Via a 3rd party framework dedicated to configuration,As attributes/variables with the same name of its associated configuration option,We read configuration options from a specific class/module,Certain expert developers,"Most of configuration options are important to the maintainability of the project, an architect or a experienced developer must do that work to assure the correct behavior of the process.","No planning, options are added ad hoc",Client requirements.;Architectural specifications.,Chat support (like Slack or Hangout);Textual documentation;Pull Request,"Yes. We do have a naming convention, but not all the developers respect it.",Sometimes,3,Log file;Error message;Documentation;Debug the code;Stack Trace,In a Bug report (like Bugzilla),"Yes, I know the impact of all the configuration options.",Documentation.;Ask a colleague;Configuration name is clear enough to be understood.,"No, they are almost stable","Remove them from the configuration files, and do not store them anywhere.",2,3,"we try to cut configuration sections in pieces that are as small as possible, and we try to make everything structured and with meaningful names. ideally, something like ""defaultMailService.smtp.username="" does not need any explanation. in cases where i cannot expect pre-existing knowledge, i might add inline comments, preferably with suggestions as to where to look for details and/or what a reasonable default is.","Yes, but we review only functional configuration options",We have tools to check correctness of the values;Using containers (like Docker) to limit the impact of configuration options.,Allow only few people to modify configuration files.,"One problem we had, all developers had access to the configuration files, and we have three servers: staging, development and production.And we have all the routes in a configuration file, the problem was the configuration file was not being reviewed, so some developers were testing and changing the routes and pushing the changes without knowing.To fix it, we limited the developers to access to that configuration options and we add the file to the code review process.","Good practices:- Keep configuration options in one place- Do not ignore them in code review process- Know how to separate configuration options from other configuration files.Bad practices:Not doing the things i mentioned above."126,12,Academic,<10,Yes,.properties file;.xml file;.json file,Via an IO library to read the configuration storage.,As attributes/variables with the same name of its associated configuration option,We read configuration options from a specific class/module,Certain expert developers,They tend to encounter new config-related issues first.,"No planning, options are added ad hoc",Ad hoc choices. It is up to the developer to decide.,Pull Request,No. We do not have any configuration options naming convention.,Sometimes,3,Log file;Error message;Debug the code,In the commit message,"Yes, I know the impact of the majority of configuration options.",Ask a colleague;Configuration option comments.;I understand configuration options from the source code,"No, they are almost stable","Remove them from the configuration files, and do not store them anywhere.",2,2,"The config system is new, so not much documentation work has been done.",We do not review configuration options at all. We only review code.,Test different configuration values,Reduce the number of configuration files.;Reduce the configuration option dependencies;Comment and document configuration options.;Reduce the number of configuration options.,"We should have anticipated nested configurations, but the config system sort of grew organically at first.  Later we had to step back and redesign it.  Using something standard earlier (JSON, YAML, S-Expressions) would have saved some later pain.",Textual documentation